{
  "schema_version": "3.0.0",
  "protocol_id": "competition_qualification_v3",
  "capability_id": "competition_production_v1",
  "state": "preregistered",
  "source_lifecycle": "full_replay_passed",
  "lifecycle_path": [
    "draft",
    "review_ready",
    "full_replay_passed",
    "qualification_candidate",
    "blind_review_passed",
    "default_candidate"
  ],
  "case_slots": ["Q01", "Q02", "Q03", "Q04", "Q05", "Q06"],
  "arms": {
    "baseline": "legacy_v2_1",
    "treatment": "competition_production_v1"
  },
  "blinding": {
    "case_identity_hidden_before_lock": true,
    "arm_identity_hidden_from_human_reviewers": true,
    "reviewer_identity_hidden_from_producers": true,
    "mapping_revealed_after_all_reviews": true,
    "reviewers_per_package": 2,
    "minimum_external_reviewers": 2,
    "minimum_independent_coordinators": 1,
    "human_decision_required": true,
    "human_signature_required": true,
    "ai_recorders_per_review": 1,
    "ai_decision_authority": false
  },
  "case_requirements": [
    "complete_official_problem",
    "all_official_attachments",
    "not_used_during_development",
    "runner_answer_isolation",
    "complete_problem_specific_paper",
    "final_excel_and_appendix_validation"
  ],
  "controls": [
    "same_problem_materials",
    "same_model_and_version",
    "same_reasoning_effort",
    "same_sampling_settings",
    "same_time_limit",
    "same_tool_permissions",
    "fresh_context",
    "no_cross_arm_reads",
    "independent_formal_validation"
  ],
  "metrics": [
    "model_quality",
    "executable_solution_rate",
    "paper_quality",
    "manual_revision_minutes",
    "conclusion_overclaim_rate"
  ],
  "promotion_thresholds": {
    "minimum_treatment_model_quality": 80,
    "minimum_model_quality_gain": 3,
    "minimum_treatment_paper_quality": 80,
    "minimum_paper_quality_gain": 3,
    "minimum_treatment_executable_rate": 0.8333333333333334,
    "minimum_revision_time_reduction_ratio": 0.1,
    "maximum_treatment_overclaim_rate": 0.05,
    "minimum_cases_with_combined_quality_gain": 4
  },
  "fatal_conditions": [
    "answer_leakage",
    "time_leakage",
    "arm_identity_leakage",
    "reviewer_identity_leakage",
    "unequal_execution_controls",
    "missing_formal_validation",
    "incomplete_official_materials",
    "missing_submission_artifacts",
    "treatment_fatal_error",
    "fabricated_human_decision",
    "ai_decision_substitution",
    "ai_record_time_order",
    "signature_invalid",
    "post_hoc_case_replacement"
  ],
  "default_candidate_requires": [
    "blind_review_passed",
    "competition_72h_simulation_passed"
  ]
}
